{
  "themeId": "deep-space",
  "colors": {
    "primary": "#6C63FF",
    "secondary": "#3F3D56",
    "accent": "#FF6584",
    "background": "#0F0E17",
    "surface": "#1A1A2E",
    "text": "#FFFFFE",
    "textSecondary": "#A7A9BE"
  },
  "fonts": {
    "heading": "Pretendard",
    "body": "Pretendard",
    "code": "JetBrains Mono"
  },
  "gradients": {
    "primary": "linear-gradient(135deg, #6C63FF 0%, #3F3D56 100%)",
    "background": "linear-gradient(180deg, #0F0E17 0%, #1A1A2E 100%)"
  }
}
